<?xml version="1.0" encoding="utf-8"?>
<AppConfigs xmlns="http://tempuri.org/SourceConfig.xsd" xmlns:xsi="http://www.w3.org/2001/XMLSchema-instance" xsi:schemaLocation="http://tempuri.org/SourceConfig.xsd SourceConfig.xsd">
  <!--<AppSetting ApplicationName="MSS-D" ResourcePath="DD:\MyWorkspace\MSS-D\mss-client-1.0\Taifook.MSS.Resources\Properties\" ResourceName="Resources.resx">
    <Setting Type="Message" SourceFilePath="\\10.100.1.124\test\20080428HKFS\Field\MSS_Message_0.4.xls" IdColumn="R" DeletedColumn="H" TypeColumn="M" SheetName="Message$" RowStartIndex="5">
      <LanguagetSetting Language="en" LanguageCode="" Column="V" />
      <LanguagetSetting Language="zh-cn" LanguageCode="zh-cn" Column="X">
      </LanguagetSetting>
      <LanguagetSetting Language="zh-tw" LanguageCode="zh-tw" Column="W">
      </LanguagetSetting>
    </Setting>
    <Setting Type="Field" SourceFilePath="\\10.100.1.124\test\20080428HKFS\Field\MSS_FieldLabel_0.5.xls" IdColumn="P" DeletedColumn="D" TypeColumn="M" SheetName="Field$" RowStartIndex="5">
      <LanguagetSetting Language="en" LanguageCode="" Column="Q" />
      <LanguagetSetting Language="zh-cn" LanguageCode="zh-cn" Column="S">
      </LanguagetSetting>
      <LanguagetSetting Language="zh-tw" LanguageCode="zh-tw" Column="R">
      </LanguagetSetting>
    </Setting>
  </AppSetting>-->

  <AppSetting ApplicationName="FXB" ResourcePath="..\Taifook.OMS.FXB.Common\Properties\" ResourceName="Resources.resx" IsDefault="true">
    <Setting Type="Message" SourceFilePath="..\Others\MSSF_Message.xls" IdColumn="R" DeletedColumn="H" TypeColumn="M" SheetName="Message$" RowStartIndex="5" TotalColumns="32">
      <LanguagetSetting Language="en" LanguageCode="" Column="V" />
      <LanguagetSetting Language="zh-cn" LanguageCode="zh-cn" Column="X"></LanguagetSetting>
      <LanguagetSetting Language="zh-tw" LanguageCode="zh-tw" Column="W"></LanguagetSetting>
    </Setting>
    <Setting Type="Field" SourceFilePath="..\Others\MSSF_FieldLabel.xls" IdColumn="P" DeletedColumn="D" TypeColumn="M" SheetName="Field$" RowStartIndex="5" TotalColumns="34">
      <LanguagetSetting Language="en" LanguageCode="" Column="Q" />
      <LanguagetSetting Language="zh-cn" LanguageCode="zh-cn" Column="S"></LanguagetSetting>
      <LanguagetSetting Language="zh-tw" LanguageCode="zh-tw" Column="R"></LanguagetSetting>
    </Setting>
  </AppSetting>
</AppConfigs>